id,name,label,description,color,fillColor,weight,rawWeight,lat,lng,emoji,notes,source,target,edgeLabel,edgeColor,edgeWeight,relationship,extra
"r-cran-knitr","r-cran-knitr","r-cran-knitr","GNU R package for dynamic report generation using Literate Programming","","","1","1","","","","Section=gnu-r; Version=1.50+dfsg-1","","","","","",""
"r-api-4.0","r-api-4.0","r-api-4.0","unknown","","","1","1","","","","missing in Packages file","","","","","",""
"r-cran-evaluate","r-cran-evaluate","r-cran-evaluate","GNU R parsing and evaluation tools","","","1","1","","","","Section=gnu-r; Version=1.0.3-1","","","","","",""
"r-cran-highr","r-cran-highr","r-cran-highr","Syntax Highlighting for R Source Code","","","1","1","","","","Section=gnu-r; Version=0.11+dfsg-1","","","","","",""
"r-cran-xfun","r-cran-xfun","r-cran-xfun","miscellaneous GNU R functions by 'Yihui Xie'","","","1","1","","","","Section=gnu-r; Version=0.51+dfsg-1","","","","","",""
"r-cran-yaml","r-cran-yaml","r-cran-yaml","Methods to convert R data to YAML and back","","","1","1","","","","Section=gnu-r; Version=2.3.10-1","","","","","",""
"libjs-mathjax","libjs-mathjax","libjs-mathjax","JavaScript display engine for LaTeX and MathML","","","1","1","","","","Section=javascript; Version=2.7.9+dfsg-1","","","","","",""
"libjs-highlight.js","libjs-highlight.js","libjs-highlight.js","JavaScript library for syntax highlighting","","","1","1","","","","Section=javascript; Version=9.18.5+dfsg1-2","","","","","",""
"libjs-jquery","libjs-jquery","libjs-jquery","JavaScript library for dynamic web applications","","","1","1","","","","Section=javascript; Version=3.6.1+dfsg+~3.5.14-1","","","","","",""
"libjs-bootstrap","libjs-bootstrap","libjs-bootstrap","HTML, CSS and JS framework","","","1","1","","","","Section=javascript; Version=3.4.1+dfsg-6","","","","","",""
"libjs-jquery-datatables","libjs-jquery-datatables","libjs-jquery-datatables","jQuery plug-in that makes nice tables from different data sources","","","1","1","","","","Section=javascript; Version=1.11.5+dfsg-2","","","","","",""
"libjs-normalize.css","libjs-normalize.css","libjs-normalize.css","unknown","","","1","1","","","","missing in Packages file","","","","","",""
"r-cran-bslib","r-cran-bslib","r-cran-bslib","custom 'bootstrap' 'Sass' themes for GNU R shiny and rmarkdown","","","1","1","","","","Section=gnu-r; Version=0.9.0+dfsg-3","","","","","",""
"r-cran-codetools","r-cran-codetools","r-cran-codetools","GNU R package providing code analysis tools","","","1","1","","","","Section=gnu-r; Version=0.2-20-1","","","","","",""
"r-cran-dbi","r-cran-dbi","r-cran-dbi","GNU R package providing a generic database interface","","","1","1","","","","Section=gnu-r; Version=1.2.3-1","","","","","",""
"r-cran-digest","r-cran-digest","r-cran-digest","GNU R package for 'hash digest' of R data structures","","","1","1","","","","Section=gnu-r; Version=0.6.37-1","","","","","",""
"r-cran-formatr","r-cran-formatr","r-cran-formatr","Format R code automatically","","","1","1","","","","Section=gnu-r; Version=1.14-2","","","","","",""
"r-cran-gridsvg","r-cran-gridsvg","r-cran-gridsvg","GNU R export 'grid' graphics as SVG","","","1","1","","","","Section=gnu-r; Version=1.7-5-1","","","","","",""
"r-cran-htmlwidgets","r-cran-htmlwidgets","r-cran-htmlwidgets","GNU R HTML Widgets","","","1","1","","","","Section=gnu-r; Version=1.6.4+dfsg-1","","","","","",""
"r-cran-jpeg","r-cran-jpeg","r-cran-jpeg","Read and write JPEG images","","","1","1","","","","Section=gnu-r; Version=0.1-10-1","","","","","",""
"r-cran-magick","r-cran-magick","r-cran-magick","advanced graphics and image-processing in GNU R","","","1","1","","","","Section=gnu-r; Version=2.8.5+dfsg-1+b1","","","","","",""
"r-cran-markdown","r-cran-markdown","r-cran-markdown","GNU R package providing R bindings to the Sundown Markdown rendering library","","","1","1","","","","Section=gnu-r; Version=1.13-1","","","","","",""
"r-cran-png","r-cran-png","r-cran-png","GNU R package to read and write PNG images","","","1","1","","","","Section=gnu-r; Version=0.1-8-1+b1","","","","","",""
"r-cran-ragg","r-cran-ragg","r-cran-ragg","GNU R graphic devices based on AGG","","","1","1","","","","Section=gnu-r; Version=1.3.3-1","","","","","",""
"r-cran-reticulate","r-cran-reticulate","r-cran-reticulate","R interface to Python modules, classes, and functions","","","1","1","","","","Section=gnu-r; Version=1.41.0.1+dfsg-1","","","","","",""
"r-cran-rgl","r-cran-rgl","r-cran-rgl","GNU R package for three-dimensional visualisation using OpenGL","","","1","1","","","","Section=gnu-r; Version=1.3.18-1","","","","","",""
"r-cran-rlang","r-cran-rlang","r-cran-rlang","Functions for Base Types and Core R and 'Tidyverse' Features","","","1","1","","","","Section=gnu-r; Version=1.1.5-3","","","","","",""
"r-cran-rmarkdown","r-cran-rmarkdown","r-cran-rmarkdown","convert R markdown documents into a variety of formats","","","1","1","","","","Section=gnu-r; Version=2.29+dfsg-1","","","","","",""
"r-cran-sass","r-cran-sass","r-cran-sass","GNU R Syntactically Awesome Style Sheets ('Sass')","","","1","1","","","","Section=gnu-r; Version=0.4.9+dfsg-1","","","","","",""
"r-cran-testit","r-cran-testit","r-cran-testit","simple package for testing GNU R packages","","","1","1","","","","Section=gnu-r; Version=0.13-1","","","","","",""
"r-cran-tibble","r-cran-tibble","r-cran-tibble","GNU R Simple Data Frames","","","1","1","","","","Section=gnu-r; Version=3.2.1+dfsg-3","","","","","",""
"r-cran-tikzdevice","r-cran-tikzdevice","r-cran-tikzdevice","unknown","","","1","1","","","","missing in Packages file","","","","","",""
"r-cran-tinytex","r-cran-tinytex","r-cran-tinytex","GNU R helper to compile LaTeX documents","","","1","1","","","","Section=gnu-r; Version=0.56-1","","","","","",""
"r-cran-webshot","r-cran-webshot","r-cran-webshot","GNU R take screenshots of web pages","","","1","1","","","","Section=gnu-r; Version=0.5.5-1","","","","","",""
"r-cran-rstudioapi","r-cran-rstudioapi","r-cran-rstudioapi","GNU R package for access to the RStudio API","","","1","1","","","","Section=gnu-r; Version=0.17.1-1","","","","","",""
"r-cran-svglite","r-cran-svglite","r-cran-svglite","GNU R 'SVG' graphics device","","","1","1","","","","Section=gnu-r; Version=2.1.3-2","","","","","",""
"node-highlight.js","node-highlight.js","node-highlight.js","JavaScript library for syntax highlighting - NodeJS","","","1","1","","","","Section=javascript; Version=9.18.5+dfsg1-2","","","","","",""
"r-cran-callr","r-cran-callr","r-cran-callr","Call GNU R from GNU R","","","1","1","","","","Section=gnu-r; Version=3.7.6-1","","","","","",""
"r-cran-covr","r-cran-covr","r-cran-covr","test coverage for GNU R packages","","","1","1","","","","Section=gnu-r; Version=3.6.4+dfsg-1","","","","","",""
"r-cran-ggplot2","r-cran-ggplot2","r-cran-ggplot2","implementation of the Grammar of Graphics","","","1","1","","","","Section=gnu-r; Version=3.5.1+dfsg-1","","","","","",""
"r-cran-lattice","r-cran-lattice","r-cran-lattice","GNU R package for 'Trellis' graphics","","","1","1","","","","Section=gnu-r; Version=0.22-7-1","","","","","",""
"r-cran-pkgload","r-cran-pkgload","r-cran-pkgload","simulate GNU R package installation and attach","","","1","1","","","","Section=gnu-r; Version=1.4.0-1","","","","","",""
"r-cran-testthat","r-cran-testthat","r-cran-testthat","GNU R testsuite","","","1","1","","","","Section=gnu-r; Version=3.2.3-1","","","","","",""
"r-cran-withr","r-cran-withr","r-cran-withr","GNU R package to run code 'With' temporarily modified global state","","","1","1","","","","Section=gnu-r; Version=3.0.2+dfsg-1","","","","","",""
"libc6","libc6","libc6","GNU C Library: Shared libraries","","","1","1","","","","Section=libs; Version=2.41-12","","","","","",""
"r-cran-mime","r-cran-mime","r-cran-mime","R package which maps filenames to MIME Types","","","1","1","","","","Section=gnu-r; Version=0.12-2","","","","","",""
"r-cran-commonmark","r-cran-commonmark","r-cran-commonmark","high performance CommonMark and Github markdown rendering in R","","","1","1","","","","Section=gnu-r; Version=1.9.5-1","","","","","",""
"r-cran-remotes","r-cran-remotes","r-cran-remotes","R Package Installation from Remote Repositories, Including 'GitHub'","","","1","1","","","","Section=gnu-r; Version=2.5.0+dfsg-1","","","","","",""
"r-cran-renv","r-cran-renv","r-cran-renv","GNU R project environments","","","1","1","","","","Section=gnu-r; Version=1.1.2-1","","","","","",""
"r-cran-curl","r-cran-curl","r-cran-curl","GNU R modern and flexible web client for R","","","1","1","","","","Section=gnu-r; Version=6.2.1+dfsg-1","","","","","",""
"r-cran-xml2","r-cran-xml2","r-cran-xml2","GNU R XML parser","","","1","1","","","","Section=gnu-r; Version=1.3.8-1","","","","","",""
"r-cran-jsonlite","r-cran-jsonlite","r-cran-jsonlite","Robust, High Performance JSON Parser and Generator for R","","","1","1","","","","Section=gnu-r; Version=1.9.1+dfsg-1","","","","","",""
"r-cran-runit","r-cran-runit","r-cran-runit","GNU R package providing unit testing framework","","","1","1","","","","Section=gnu-r; Version=0.4.33-1","","","","","",""
"fonts-mathjax","fonts-mathjax","fonts-mathjax","JavaScript display engine for LaTeX and MathML (fonts)","","","1","1","","","","Section=fonts; Version=2.7.9+dfsg-1","","","","","",""
"javascript-common","javascript-common","javascript-common","Base support for JavaScript library packages","","","1","1","","","","Section=javascript; Version=12+nmu1","","","","","",""
"fonts-glyphicons-halflings","fonts-glyphicons-halflings","fonts-glyphicons-halflings","icons made for smaller graphic","","","1","1","","","","Section=javascript; Version=1.009~3.4.1+dfsg-6","","","","","",""
"r-cran-base64enc","r-cran-base64enc","r-cran-base64enc","GNU R package that provides tools for base64 encoding","","","1","1","","","","Section=gnu-r; Version=0.1-3-3","","","","","",""
"r-cran-cachem","r-cran-cachem","r-cran-cachem","cache GNU R objects with automatic pruning","","","1","1","","","","Section=gnu-r; Version=1.1.0-1","","","","","",""
"r-cran-fastmap","r-cran-fastmap","r-cran-fastmap","GNU R fast implementation of a key-value store","","","1","1","","","","Section=gnu-r; Version=1.2.0-1","","","","","",""
"r-cran-htmltools","r-cran-htmltools","r-cran-htmltools","GNU R tools for HTML","","","1","1","","","","Section=gnu-r; Version=0.5.8.1-1","","","","","",""
"r-cran-jquerylib","r-cran-jquerylib","r-cran-jquerylib","obtain 'jQuery' as an HTML dependency object in GNU R","","","1","1","","","","Section=gnu-r; Version=0.1.4+dfsg-4","","","","","",""
"r-cran-lifecycle","r-cran-lifecycle","r-cran-lifecycle","manage the life cycle of your GNU R package functions","","","1","1","","","","Section=gnu-r; Version=1.0.4+dfsg-1","","","","","",""
"r-cran-memoise","r-cran-memoise","r-cran-memoise","Memoise functions","","","1","1","","","","Section=gnu-r; Version=2.0.1-1","","","","","",""
"node-bootstrap-sass","node-bootstrap-sass","node-bootstrap-sass","Sass-powered version of Bootstrap 3","","","1","1","","","","Section=javascript; Version=3.4.3-2","","","","","",""
"libjs-bootstrap4","libjs-bootstrap4","libjs-bootstrap4","HTML, CSS and JS framework","","","1","1","","","","Section=javascript; Version=4.6.2+dfsg-1","","","","","",""
"r-cran-fontawesome","r-cran-fontawesome","r-cran-fontawesome","GNU R support of 'Font Awesome' Icons","","","1","1","","","","Section=gnu-r; Version=0.5.3-1","","","","","",""
"r-cran-future","r-cran-future","r-cran-future","R package: A Future API for R","","","1","1","","","","Section=gnu-r; Version=1.34.0+dfsg-1","","","","","",""
"r-cran-magrittr","r-cran-magrittr","r-cran-magrittr","GNU R forward-pipe operator","","","1","1","","","","Section=gnu-r; Version=2.0.3-1","","","","","",""
"r-cran-rappdirs","r-cran-rappdirs","r-cran-rappdirs","GNU R application directories","","","1","1","","","","Section=gnu-r; Version=0.3.3-1","","","","","",""
"r-cran-shiny","r-cran-shiny","r-cran-shiny","GNU R web application framework","","","1","1","","","","Section=gnu-r; Version=1.10.0+dfsg-2","","","","","",""
"r-cran-thematic","r-cran-thematic","r-cran-thematic","unified and automatic theming for GNU R","","","1","1","","","","Section=gnu-r; Version=0.1.6-1","","","","","",""
"libgcc-s1","libgcc-s1","libgcc-s1","GCC support library","","","1","1","","","","Section=libs; Version=14.2.0-19","","","","","",""
"r-base-core","r-base-core","r-base-core","GNU R core of statistical computation and graphics system","","","1","1","","","","Section=gnu-r; Version=4.5.0-3","","","","","",""
"r-cran-xml","r-cran-xml","r-cran-xml","GNU R package for XML parsing and generation","","","1","1","","","","Section=gnu-r; Version=3.99-0.18-1","","","","","",""
"libjpeg62-turbo","libjpeg62-turbo","libjpeg62-turbo","libjpeg-turbo JPEG runtime library","","","1","1","","","","Section=libs; Version=1:2.1.5-4","","","","","",""
"r-graphics-engine-16","r-graphics-engine-16","r-graphics-engine-16","unknown","","","1","1","","","","missing in Packages file","","","","","",""
"r-cran-rcpp","r-cran-rcpp","r-cran-rcpp","GNU R package for Seamless R and C++ Integration","","","1","1","","","","Section=gnu-r; Version=1.0.14-1","","","","","",""
"libmagick++-7.q16-5","libmagick++-7.q16-5","libmagick++-7.q16-5","C++ interface to ImageMagick -- quantum depth Q16","","","1","1","","","","Section=libs; Version=8:7.1.1.43+dfsg1-1+deb13u1","","","","","",""
"libmagickcore-7.q16-10","libmagickcore-7.q16-10","libmagickcore-7.q16-10","low-level image manipulation library -- quantum depth Q16","","","1","1","","","","Section=libs; Version=8:7.1.1.43+dfsg1-1+deb13u1","","","","","",""
"libmagickwand-7.q16-10","libmagickwand-7.q16-10","libmagickwand-7.q16-10","image manipulation library -- quantum depth Q16","","","1","1","","","","Section=libs; Version=8:7.1.1.43+dfsg1-1+deb13u1","","","","","",""
"libstdc++6","libstdc++6","libstdc++6","GNU Standard C++ Library v3","","","1","1","","","","Section=libs; Version=14.2.0-19","","","","","",""
"r-cran-av","r-cran-av","r-cran-av","working with Audio and Video in GNU R","","","1","1","","","","Section=gnu-r; Version=0.9.0+dfsg-1+b1","","","","","",""
"r-cran-spelling","r-cran-spelling","r-cran-spelling","tools for spell checking in GNU R","","","1","1","","","","Section=gnu-r; Version=2.3.1-1","","","","","",""
"r-cran-rsvg","r-cran-rsvg","r-cran-rsvg","GNU R render SVG images into PDF, PNG, PostScript, or bitmap arrays","","","1","1","","","","Section=gnu-r; Version=2.6.1-1","","","","","",""
"r-cran-pdftools","r-cran-pdftools","r-cran-pdftools","GNU R text extraction, rendering and converting of PDF documents","","","1","1","","","","Section=gnu-r; Version=3.5.0-1","","","","","",""
"r-cran-irdisplay","r-cran-irdisplay","r-cran-irdisplay","Rich display library for the Jupyter R kernel","","","1","1","","","","Section=gnu-r; Version=1.1-1","","","","","",""
"r-cran-rcurl","r-cran-rcurl","r-cran-rcurl","GNU R General network (HTTP/FTP/...) client interface","","","1","1","","","","Section=gnu-r; Version=1.98-1.16+dfsg-1","","","","","",""
"libpng16-16t64","libpng16-16t64","libpng16-16t64","PNG library - runtime (version 1.6)","","","1","1","","","","Section=libs; Version=1.6.48-1","","","","","",""
"r-cran-systemfonts","r-cran-systemfonts","r-cran-systemfonts","system native font finding for GNU R","","","1","1","","","","Section=gnu-r; Version=1.2.1-1","","","","","",""
"r-cran-textshaping","r-cran-textshaping","r-cran-textshaping","GNU R bindings to the 'HarfBuzz' and 'Fribidi' libraries for text shaping","","","1","1","","","","Section=gnu-r; Version=0.3.7-2","","","","","",""
"libfreetype6","libfreetype6","libfreetype6","FreeType 2 font engine, shared library files","","","1","1","","","","Section=libs; Version=2.13.3+dfsg-1","","","","","",""
"libtiff6","libtiff6","libtiff6","Tag Image File Format (TIFF) library","","","1","1","","","","Section=libs; Version=4.7.0-3","","","","","",""
"r-cran-matrix","r-cran-matrix","r-cran-matrix","GNU R package of classes for dense and sparse matrices","","","1","1","","","","Section=gnu-r; Version=1.7-3-1","","","","","",""
"r-cran-rcpptoml","r-cran-rcpptoml","r-cran-rcpptoml","'Rcpp' Bindings to Parser for Tom's Obvious Markup Language","","","1","1","","","","Section=gnu-r; Version=0.2.3+dfsg-1","","","","","",""
"r-cran-here","r-cran-here","r-cran-here","GNU R simpler way to find files","","","1","1","","","","Section=gnu-r; Version=1.0.1-2","","","","","",""
"python3","python3","python3","interactive high-level object-oriented language (default python3 version)","","","1","1","","","","Section=python; Version=3.13.5-1","","","","","",""
"r-cran-glue","r-cran-glue","r-cran-glue","GNU R interpreted string literals","","","1","1","","","","Section=gnu-r; Version=1.8.0-1","","","","","",""
"r-cran-cli","r-cran-cli","r-cran-cli","GNU R helpers for developing command line interfaces","","","1","1","","","","Section=gnu-r; Version=3.6.4-1","","","","","",""
"r-cran-pillar","r-cran-pillar","r-cran-pillar","GNU R coloured formatting for columns","","","1","1","","","","Section=gnu-r; Version=1.10.1+dfsg-1","","","","","",""
"libgl1","libgl1","libgl1","Vendor neutral GL dispatch library -- legacy GL support","","","1","1","","","","Section=libs; Version=1.7.0-1+b2","","","","","",""
"libglu1-mesa","libglu1-mesa","libglu1-mesa","Mesa OpenGL utility library (GLU)","","","1","1","","","","Section=libs; Version=9.0.2-1.1+b3","","","","","",""
"libx11-6","libx11-6","libx11-6","X11 client-side library","","","1","1","","","","Section=libs; Version=2:1.8.12-1","","","","","",""
"r-cran-r6","r-cran-r6","r-cran-r6","R classes with reference semantics","","","1","1","","","","Section=gnu-r; Version=2.6.1-1","","","","","",""
"r-cran-crosstalk","r-cran-crosstalk","r-cran-crosstalk","GNU R inter-widget interactivity for HTML widgets","","","1","1","","","","Section=gnu-r; Version=1.2.1+dfsg-1","","","","","",""
"r-cran-crayon","r-cran-crayon","r-cran-crayon","GNU R colored terminal output","","","1","1","","","","Section=gnu-r; Version=1.5.3-1","","","","","",""
"r-cran-fs","r-cran-fs","r-cran-fs","GNU R cross-platform file system operations","","","1","1","","","","Section=gnu-r; Version=1.6.5+dfsg-1","","","","","",""
"r-cran-usethis","r-cran-usethis","r-cran-usethis","Automate Package and Project Setup","","","1","1","","","","Section=gnu-r; Version=3.1.0-1","","","","","",""
"r-cran-vctrs","r-cran-vctrs","r-cran-vctrs","GNU R vector helpers","","","1","1","","","","Section=gnu-r; Version=0.6.5-1","","","","","",""
"libjs-jquery-ui","libjs-jquery-ui","libjs-jquery-ui","JavaScript UI library for dynamic web applications","","","1","1","","","","Section=javascript; Version=1.13.2+dfsg-1","","","","","",""
"libjs-modernizr","libjs-modernizr","libjs-modernizr","JavaScript library to detect HTML5 and CSS3 features in the user's browser","","","1","1","","","","Section=javascript; Version=3.13.0-0.1","","","","","",""
"libjs-prettify","libjs-prettify","libjs-prettify","syntax highlighting of source code snippets in an html page","","","1","1","","","","Section=javascript; Version=2015.12.04+dfsg-1.1","","","","","",""
"fonts-font-awesome","fonts-font-awesome","fonts-font-awesome","iconic font designed for use with Twitter Bootstrap","","","1","1","","","","Section=fonts; Version=5.0.10+really4.7.0~dfsg-4.1","","","","","",""
"pandoc","pandoc","pandoc","general markup converter","","","1","1","","","","Section=text; Version=3.1.11.1+ds-2","","","","","",""
"node-html5shiv","node-html5shiv","node-html5shiv","enable use of HTML5 sectioning elements in legacy browser","","","1","1","","","","Section=javascript; Version=3.7.3+dfsg-5","","","","","",""
"r-cran-dygraphs","r-cran-dygraphs","r-cran-dygraphs","GNU R interface to 'Dygraphs' interactive time series charting library","","","1","1","","","","Section=gnu-r; Version=1.1.1.6+dfsg-4","","","","","",""
"r-cran-rsconnect","r-cran-rsconnect","r-cran-rsconnect","GNU R deployment interface for markdown and Shiny applications","","","1","1","","","","Section=gnu-r; Version=1.3.4-1","","","","","",""
"r-cran-downlit","r-cran-downlit","r-cran-downlit","GNU R syntax highlighting and automatic linking","","","1","1","","","","Section=gnu-r; Version=0.4.4-1","","","","","",""
"r-cran-fansi","r-cran-fansi","r-cran-fansi","GNU R ANSI control sequence aware string functions","","","1","1","","","","Section=gnu-r; Version=1.0.6-2","","","","","",""
"r-cran-pkgconfig","r-cran-pkgconfig","r-cran-pkgconfig","Private Configuration for 'R' Packages","","","1","1","","","","Section=gnu-r; Version=2.0.3-2","","","","","",""
"r-cran-bench","r-cran-bench","r-cran-bench","High Precision Timing of R Expressions","","","1","1","","","","Section=gnu-r; Version=1.1.4-1","","","","","",""
"r-cran-bit64","r-cran-bit64","r-cran-bit64","A S3 Class for Vectors of 64bit Integers","","","1","1","","","","Section=gnu-r; Version=4.6.0-1-4","","","","","",""
"r-cran-blob","r-cran-blob","r-cran-blob","GNU R S3 Class for Representing Vectors of Binary Data ('BLOBS')","","","1","1","","","","Section=gnu-r; Version=1.2.4-1","","","","","",""
"r-cran-brio","r-cran-brio","r-cran-brio","basic R input output","","","1","1","","","","Section=gnu-r; Version=1.1.5-1","","","","","",""
"r-cran-diagrammer","r-cran-diagrammer","r-cran-diagrammer","Graph/Network Visualization","","","1","1","","","","Section=gnu-r; Version=1.0.11+ds-2","","","","","",""
"r-cran-dplyr","r-cran-dplyr","r-cran-dplyr","GNU R grammar of data manipulation","","","1","1","","","","Section=gnu-r; Version=1.1.4-4","","","","","",""
"r-cran-formattable","r-cran-formattable","r-cran-formattable","GNU R create 'formattable' data structures","","","1","1","","","","Section=gnu-r; Version=0.2.1+dfsg-1","","","","","",""
"r-cran-hms","r-cran-hms","r-cran-hms","GNU R pretty time of day","","","1","1","","","","Section=gnu-r; Version=1.1.3-1","","","","","",""
"r-cran-lubridate","r-cran-lubridate","r-cran-lubridate","simplifies dealing with dates in R","","","1","1","","","","Section=gnu-r; Version=1.9.4+dfsg-1","","","","","",""
"r-cran-pkgbuild","r-cran-pkgbuild","r-cran-pkgbuild","find tools needed to build GNU R packages","","","1","1","","","","Section=gnu-r; Version=1.4.6-1","","","","","",""
"r-cran-purrr","r-cran-purrr","r-cran-purrr","GNU R functional programming tools","","","1","1","","","","Section=gnu-r; Version=1.0.4-1","","","","","",""
"r-cran-stringi","r-cran-stringi","r-cran-stringi","GNU R character string processing facilities","","","1","1","","","","Section=gnu-r; Version=1.8.4-1+b1","","","","","",""
"r-cran-tidyr","r-cran-tidyr","r-cran-tidyr","GNU R package to easily tidy data","","","1","1","","","","Section=gnu-r; Version=1.3.1-1","","","","","",""
"r-cran-cpp11","r-cran-cpp11","r-cran-cpp11","C++11 interface for GNU R's C interface","","","1","1","","","","Section=gnu-r; Version=0.5.2-1","","","","","",""
"r-cran-fontquiver","r-cran-fontquiver","r-cran-fontquiver","set of installed fonts for GNU R","","","1","1","","","","Section=gnu-r; Version=0.2.1-4","","","","","",""
"","","","","","","","","","","","","r-cran-knitr","r-api-4.0","Depends","#333","1","Depends","{}"
"","","","","","","","","","","","","r-cran-knitr","r-cran-evaluate","Depends","#333","1","Depends","{}"
"","","","","","","","","","","","","r-cran-knitr","r-cran-highr","Depends","#333","1","Depends","{}"
"","","","","","","","","","","","","r-cran-knitr","r-cran-xfun","Depends","#333","1","Depends","{}"
"","","","","","","","","","","","","r-cran-knitr","r-cran-yaml","Depends","#333","1","Depends","{}"
"","","","","","","","","","","","","r-cran-knitr","libjs-mathjax","Depends","#333","1","Depends","{}"
"","","","","","","","","","","","","r-cran-knitr","libjs-highlight.js","Depends","#333","1","Depends","{}"
"","","","","","","","","","","","","r-cran-knitr","libjs-jquery","Depends","#333","1","Depends","{}"
"","","","","","","","","","","","","r-cran-knitr","libjs-bootstrap","Depends","#333","1","Depends","{}"
"","","","","","","","","","","","","r-cran-knitr","libjs-jquery-datatables","Depends","#333","1","Depends","{}"
"","","","","","","","","","","","","r-cran-knitr","libjs-normalize.css","Depends","#333","1","Depends","{}"
"","","","","","","","","","","","","r-cran-knitr","r-cran-bslib","Recommends","#333","1","Recommends","{}"
"","","","","","","","","","","","","r-cran-knitr","r-cran-codetools","Recommends","#333","1","Recommends","{}"
"","","","","","","","","","","","","r-cran-knitr","r-cran-dbi","Recommends","#333","1","Recommends","{}"
"","","","","","","","","","","","","r-cran-knitr","r-cran-digest","Recommends","#333","1","Recommends","{}"
"","","","","","","","","","","","","r-cran-knitr","r-cran-formatr","Recommends","#333","1","Recommends","{}"
"","","","","","","","","","","","","r-cran-knitr","r-cran-gridsvg","Recommends","#333","1","Recommends","{}"
"","","","","","","","","","","","","r-cran-knitr","r-cran-htmlwidgets","Recommends","#333","1","Recommends","{}"
"","","","","","","","","","","","","r-cran-knitr","r-cran-jpeg","Recommends","#333","1","Recommends","{}"
"","","","","","","","","","","","","r-cran-knitr","r-cran-magick","Recommends","#333","1","Recommends","{}"
"","","","","","","","","","","","","r-cran-knitr","r-cran-markdown","Recommends","#333","1","Recommends","{}"
"","","","","","","","","","","","","r-cran-knitr","r-cran-png","Recommends","#333","1","Recommends","{}"
"","","","","","","","","","","","","r-cran-knitr","r-cran-ragg","Recommends","#333","1","Recommends","{}"
"","","","","","","","","","","","","r-cran-knitr","r-cran-reticulate","Recommends","#333","1","Recommends","{}"
"","","","","","","","","","","","","r-cran-knitr","r-cran-rgl","Recommends","#333","1","Recommends","{}"
"","","","","","","","","","","","","r-cran-knitr","r-cran-rlang","Recommends","#333","1","Recommends","{}"
"","","","","","","","","","","","","r-cran-knitr","r-cran-rmarkdown","Recommends","#333","1","Recommends","{}"
